{
  "run_id": "discovery-02-font-licensing-mcp-bare-1",
  "task_id": "discovery-02-font-licensing",
  "arm": "mcp-bare",
  "trial": 1,
  "montagent_version": "0.2.1",
  "composite_verdict": "Partial Success",
  "dimensions": {
    "discovery": "Hint-Prompted",
    "selection": "Acceptable Alternative",
    "execution": "Recovered Pass",
    "guessing": "Incidental",
    "missed_capability": "Flagged"
  },
  "metrics": {
    "discovery_turns": 5,
    "total_turns": 11,
    "total_tokens": 32000,
    "discovery_effort_tier": "Direct"
  },
  "attribution": {
    "primary_code": "SELECTION_AMBIGUITY",
    "rationale": "Agent required multiple exploration attempts to discover native font vendor resolution."
  }
}