{
  "run_id": "discovery-01-assembly-inspect-mcp-skills-1",
  "task_id": "discovery-01-assembly-inspect",
  "arm": "mcp-skills",
  "trial": 1,
  "montagent_version": "0.2.1",
  "composite_verdict": "Full Success",
  "dimensions": {
    "discovery": "Inspected",
    "selection": "Native Optimal",
    "execution": "Clean Pass",
    "guessing": "Clean",
    "missed_capability": "None"
  },
  "metrics": {
    "discovery_turns": 2,
    "total_turns": 4,
    "total_tokens": 12500,
    "discovery_effort_tier": "Direct"
  },
  "attribution": {
    "primary_code": "NONE",
    "rationale": "Clean pass with optimal native tool selection via skill assistance."
  }
}